{
  "description": "Gaussian with derivative functions and generated data for scans.",
  "modified_from_source": true,
  "notes": [
    "The original tutorial has no data; this fixture adds a toy dataset."
  ],
  "reference_backend": "roofit 6.41.01",
  "schema_version": 1,
  "source": "ROOT RooFit tutorial rf111_derivatives.py",
  "test_id": "rf111_derivatives",
  "title": "RooFit rf111 derivatives"
}
