{
  "description": "Gaussian plus polynomial mixture with a named observable range.",
  "modified_from_source": false,
  "notes": [],
  "reference_backend": "roofit 6.41.01",
  "schema_version": 1,
  "source": "ROOT RooFit tutorial rf203_ranges.py",
  "test_id": "rf203_ranges",
  "title": "RooFit rf203 ranges"
}
