{
  "description": "Exponential model multiplied by an efficiency turn-on function.",
  "modified_from_source": false,
  "notes": [],
  "reference_backend": "roofit 6.41.01",
  "schema_version": 1,
  "source": "ROOT RooFit tutorial rf703_effpdfprod.py",
  "test_id": "rf703_effpdfprod",
  "title": "RooFit rf703 efficiency product PDF"
}
